[
  {
    "claim_id": "CLAIM-AD-001",
    "statement": "La atención es limitada y la selección de información está influida por la relevancia y el valor esperado de obtener información.",
    "epistemic_status": "established",
    "evidence_status": "unresolved",
    "review_status": "suspended",
    "confidence": "high",
    "scope": "Procesos generales de selección atencional y búsqueda de información; no especifica todas las variables que determinan atención en contextos reales.",
    "limitations": "No valida nueve rutas discretas ni permite predecir qué estímulo atenderá una persona concreta.",
    "allowed_uses": [
      "internal_research"
    ],
    "supported_by": [
      {
        "source_id": "SRC-GOTTLIEB-ETAL-2013",
        "relation": "unspecified_legacy"
      },
      {
        "source_id": "SRC-KIDD-HAYDEN-2015",
        "relation": "unspecified_legacy"
      }
    ],
    "last_verified": "2026-09-03",
    "file_source": "claims_attention_decision.md"
  },
  {
    "claim_id": "CLAIM-AD-002",
    "statement": "Vincular información con el self puede mejorar su codificación y recuerdo frente a ciertos tipos de procesamiento no autorreferencial.",
    "epistemic_status": "supported",
    "evidence_status": "unresolved",
    "review_status": "suspended",
    "confidence": "high",
    "scope": "Efecto de referencia al self en paradigmas experimentales de memoria; condiciones y magnitud dependen de tarea y población.",
    "limitations": "No demuestra que todo mensaje personalizado sea más persuasivo ni que Identidad sea una dimensión psicométrica independiente.",
    "allowed_uses": [
      "internal_research"
    ],
    "supported_by": [
      {
        "source_id": "SRC-ROGERS-KUIPER-KIRKER-1977",
        "relation": "unspecified_legacy"
      },
      {
        "source_id": "SRC-OYSERMAN-2009",
        "relation": "unspecified_legacy"
      }
    ],
    "last_verified": "2026-09-03",
    "file_source": "claims_attention_decision.md"
  },
  {
    "claim_id": "CLAIM-AD-003",
    "statement": "El encuadre de alternativas como ganancias o pérdidas puede modificar preferencias aun cuando los resultados descritos sean formalmente equivalentes.",
    "epistemic_status": "established",
    "evidence_status": "unresolved",
    "review_status": "suspended",
    "confidence": "high",
    "scope": "Decisiones bajo riesgo e incertidumbre en condiciones compatibles con los paradigmas estudiados.",
    "limitations": "No afirma que toda persona evite pérdidas siempre ni que Pérdida sea equivalente a prospect theory.",
    "allowed_uses": [
      "internal_research"
    ],
    "supported_by": [
      {
        "source_id": "SRC-KAHNEMAN-TVERSKY-1979",
        "relation": "unspecified_legacy"
      },
      {
        "source_id": "SRC-TVERSKY-KAHNEMAN-1981",
        "relation": "unspecified_legacy"
      }
    ],
    "last_verified": "2026-09-03",
    "file_source": "claims_attention_decision.md"
  },
  {
    "claim_id": "CLAIM-AD-004",
    "statement": "Las señales contextuales pueden activar respuestas habituales sin una evaluación deliberativa completa de sus consecuencias actuales.",
    "epistemic_status": "established",
    "evidence_status": "unresolved",
    "review_status": "suspended",
    "confidence": "high",
    "scope": "Hábitos formados por repetición en contextos estables; el grado de automaticidad varía.",
    "limitations": "No implica ausencia total de conciencia ni que los hábitos sean inseguros. No valida Conveniencia/Rutina como escala.",
    "allowed_uses": [
      "internal_research"
    ],
    "supported_by": [
      {
        "source_id": "SRC-WOOD-NEAL-2007",
        "relation": "unspecified_legacy"
      },
      {
        "source_id": "SRC-ADRIAANSE-ETAL-2011",
        "relation": "unspecified_legacy"
      }
    ],
    "last_verified": "2026-09-03",
    "file_source": "claims_attention_decision.md"
  },
  {
    "claim_id": "CLAIM-AD-005",
    "statement": "La taxonomía integrada de nueve Attention Doors es una formulación provisional del proyecto y no una escala psicométrica validada.",
    "epistemic_status": "provisional",
    "evidence_status": "unresolved",
    "review_status": "suspended",
    "confidence": "high",
    "scope": "Estado epistemológico interno del framework a la fecha de verificación.",
    "limitations": "No afirma que la taxonomía sea falsa o inútil. Exige presentar perfiles como hipótesis de reflexión y separar Canon de validación empírica.",
    "allowed_uses": [
      "internal_research"
    ],
    "supported_by": [],
    "last_verified": "2026-09-03",
    "file_source": "claims_attention_decision.md",
    "grounded_in": [
      "CON-ATTENTION-DOORS",
      "CON-EPISTEMIC-BOUNDARIES"
    ]
  },
  {
    "claim_id": "CLAIM-AD-006",
    "statement": "Las nueve puertas pueden solaparse conceptualmente y el modelo no debe asumir independencia estadística, exclusividad mutua ni universalidad.",
    "epistemic_status": "provisional",
    "evidence_status": "unresolved",
    "review_status": "suspended",
    "confidence": "high",
    "scope": "Regla de modelado y límite de inferencia del framework, pendiente de estudios de estructura y validez.",
    "limitations": "No establece correlaciones empíricas ni combinaciones universales. Las relaciones documentadas son hipótesis de trabajo.",
    "allowed_uses": [
      "internal_research"
    ],
    "supported_by": [],
    "last_verified": "2026-09-03",
    "file_source": "claims_attention_decision.md",
    "grounded_in": [
      "DOOR-RELATIONS",
      "CON-ATTENTION-DOORS"
    ]
  },
  {
    "claim_id": "CLAIM-GENAI-001",
    "statement": "Los LLM pueden automatizar partes de la investigación, redacción y personalización de campañas de spear phishing.",
    "epistemic_status": "supported",
    "evidence_status": "unresolved",
    "review_status": "suspended",
    "confidence": "high",
    "scope": "Demostraciones y estudios experimentales con modelos y flujos concretos; capacidad técnica, no prevalencia delictiva observada.",
    "limitations": "No afirma que todos los atacantes usen IA, que el flujo sea completamente autónomo en la práctica ni que toda personalización aumente éxito.",
    "allowed_uses": [
      "internal_research"
    ],
    "supported_by": [
      {
        "source_id": "SRC-HAZELL-2023",
        "relation": "unspecified_legacy"
      },
      {
        "source_id": "SRC-HEIDING-ETAL-2024",
        "relation": "unspecified_legacy"
      },
      {
        "source_id": "SRC-BETHANY-ETAL-2024",
        "relation": "unspecified_legacy"
      }
    ],
    "last_verified": "2026-09-03",
    "file_source": "claims_genai_social_engineering.md"
  },
  {
    "claim_id": "CLAIM-GENAI-002",
    "statement": "En estudios específicos, mensajes personalizados generados con LLM han alcanzado niveles de persuasión o respuesta comparables con mensajes elaborados por humanos.",
    "epistemic_status": "supported",
    "evidence_status": "unresolved",
    "review_status": "suspended",
    "confidence": "medium",
    "scope": "Estudios con muestras, canales, modelos y outcomes particulares; incluye medidas de ranking, intención de clic o clic observado según el estudio.",
    "limitations": "No autoriza afirmar superioridad universal de IA, «ataques perfectos» ni tasas de éxito aplicables a cualquier población. No deben combinarse outcomes distintos como si fueran equivalentes.",
    "allowed_uses": [
      "internal_research"
    ],
    "supported_by": [
      {
        "source_id": "SRC-FRANCIA-ETAL-2024",
        "relation": "unspecified_legacy"
      },
      {
        "source_id": "SRC-HEIDING-ETAL-2024",
        "relation": "unspecified_legacy"
      }
    ],
    "last_verified": "2026-09-03",
    "file_source": "claims_genai_social_engineering.md"
  },
  {
    "claim_id": "CLAIM-GENAI-003",
    "statement": "Información pública o voluntariamente aportada puede utilizarse para construir mensajes contextuales y perfiles funcionales orientados a personalización.",
    "epistemic_status": "supported",
    "evidence_status": "unresolved",
    "review_status": "suspended",
    "confidence": "high",
    "scope": "Datos accesibles dentro del diseño de cada estudio; la precisión, legalidad y disponibilidad varían por objetivo y jurisdicción.",
    "limitations": "No significa que el perfil sea verdadero, completo o psicológico. Tampoco justifica buscar datos externos de participantes sin consentimiento.",
    "allowed_uses": [
      "internal_research"
    ],
    "supported_by": [
      {
        "source_id": "SRC-HAZELL-2023",
        "relation": "unspecified_legacy"
      },
      {
        "source_id": "SRC-FRANCIA-ETAL-2024",
        "relation": "unspecified_legacy"
      },
      {
        "source_id": "SRC-HEIDING-ETAL-2024",
        "relation": "unspecified_legacy"
      }
    ],
    "last_verified": "2026-09-03",
    "file_source": "claims_genai_social_engineering.md"
  },
  {
    "claim_id": "CLAIM-GENAI-004",
    "statement": "Calidad lingüística, tono familiar y coherencia visual son evidencia insuficiente para establecer autenticidad, especialmente cuando herramientas generativas pueden reproducir esas características.",
    "epistemic_status": "supported",
    "evidence_status": "unresolved",
    "review_status": "suspended",
    "confidence": "medium",
    "scope": "Evaluación de mensajes digitales; se refiere a insuficiencia de estas señales aisladas, no a su ausencia total de valor.",
    "limitations": "No afirma que sea imposible detectar phishing por señales externas ni que todo mensaje impecable haya sido generado por IA.",
    "allowed_uses": [
      "internal_research"
    ],
    "supported_by": [
      {
        "source_id": "SRC-FRANCIA-ETAL-2024",
        "relation": "unspecified_legacy"
      },
      {
        "source_id": "SRC-HEIDING-ETAL-2024",
        "relation": "unspecified_legacy"
      },
      {
        "source_id": "SRC-BETHANY-ETAL-2024",
        "relation": "unspecified_legacy"